{
  "$schema": "https://json-schema.org/draft/2020-12/schema",
  "$id": "https://hyfib.com/tailor360/events/billing.cashier-session-closed.v1.schema.json",
  "title": "billing.cashier-session-closed.v1",
  "description": "A cashier session was counted and closed: what it should have held over every mode, what was counted, and the difference. The denomination sheet and the reason stay on the record; the event carries identifiers and figures only.",
  "type": "object",
  "additionalProperties": true,
  "$comment": "additionalProperties is true on purpose. conventions.md section 5.5 permits additive changes within a major version, so a subscriber must tolerate a field it has not seen; a closed schema would make every such addition breaking. required lists the fields present when v1 was published — a field added within v1 is optional forever, because a dead-lettered message replayed later carries the payload as it was written.",
  "required": [
    "eventId",
    "occurredAt",
    "aggregateId",
    "organisationId",
    "branchId",
    "cashierId",
    "openedAt",
    "closedAt",
    "expectedTotal",
    "countedTotal",
    "variance",
    "currency",
    "eventType",
    "schemaVersion"
  ],
  "properties": {
    "eventId": {
      "type": "string",
      "format": "uuid",
      "description": "Identity of this occurrence. Delivery is at least once; consumers de-duplicate on it."
    },
    "occurredAt": {
      "type": "string",
      "format": "date-time",
      "description": "When it happened, in UTC."
    },
    "aggregateId": {
      "type": "string",
      "format": "uuid",
      "description": "The cashier session."
    },
    "organisationId": {
      "type": "string",
      "format": "uuid",
      "description": "The organisation."
    },
    "branchId": {
      "type": "string",
      "format": "uuid",
      "description": "The branch whose drawer it was."
    },
    "cashierId": {
      "type": "string",
      "format": "uuid",
      "description": "The cashier accountable for it. An identifier and nothing more."
    },
    "openedAt": {
      "type": "string",
      "format": "date-time",
      "description": "When the session opened, in UTC."
    },
    "closedAt": {
      "type": "string",
      "format": "date-time",
      "description": "When it closed, in UTC."
    },
    "expectedTotal": {
      "type": "number",
      "multipleOf": 0.01,
      "description": "Over every mode, what the session should have held — the float counted into cash — to the paisa, in currency."
    },
    "countedTotal": {
      "type": "number",
      "multipleOf": 0.01,
      "description": "Over every mode, what was counted, to the paisa, in currency."
    },
    "variance": {
      "type": "number",
      "multipleOf": 0.01,
      "description": "Counted minus expected: positive is over, negative is short."
    },
    "currency": {
      "type": "string",
      "minLength": 3,
      "maxLength": 3,
      "description": "ISO 4217, INR today (conventions.md section 1.1)."
    },
    "eventType": {
      "type": "string",
      "const": "billing.cashier-session-closed.v1",
      "description": "The wire name."
    },
    "schemaVersion": {
      "type": "integer",
      "const": 1,
      "description": "The payload's major version. Agrees with the .v suffix of eventType."
    }
  }
}
